{
  "schema": "aidlc.evidence/v1",
  "change_id": "no-name-points-at-nothing",
  "contract_digest": "sha256:8cfe4bcded3fbe1b58a2957cff670d09062d1ea0bee1b9bd8f01ca1f80edca92",
  "generated_at": "2026-09-03T05:25:13.325Z",
  "capabilities": {
    "secrets": "PASS",
    "test": "PASS — 218 pass, 0 fail",
    "scope-drift": "PASS",
    "budget": "PASS"
  },
  "behaviours": {
    "B1": {
      "status": "pass",
      "evidence": [
        "test/contracts.test.mjs :: every stage entry in every harness.toml resolves to something that runs",
        "written before the fix: it failed naming both examples and the exact entry"
      ]
    },
    "B2": {
      "status": "pass",
      "evidence": [
        "the test walks the repository for harness.toml rather than listing them, and asserts it found at least five"
      ]
    },
    "B3": {
      "status": "pass",
      "evidence": [
        "examples/scratch-py and examples/scratch-ts commit stages both name scope-drift"
      ]
    },
    "B4": {
      "status": "pass",
      "evidence": [
        "test/contracts.test.mjs :: the examples still differ from each other"
      ]
    },
    "B5": {
      "status": "pass",
      "evidence": [
        ".aidlc/artifacts/intent/status-grades-two-lifecycles.md reads closed and names retire-the-legacy-lifecycle as its resolution"
      ]
    }
  },
  "review": {
    "status": "pending",
    "note": "Implementation complete and checks green. Human review (gate 3) outstanding."
  }
}
