{
  "schema": "aidlc.evidence/v1",
  "change_id": "retire-the-legacy-lifecycle",
  "contract_digest": "sha256:56c8bbfc9462bbf155f3096f974a6a71f6b3bf1cf9ab1eae7f5377293f2216b8",
  "generated_at": "2026-09-02T13:49:26.905Z",
  "capabilities": {
    "secrets": "PASS",
    "test": "PASS — node --test test/*.test.mjs — 214 pass, 0 fail",
    "scope-drift": "PASS",
    "budget": "PASS"
  },
  "behaviours": {
    "B1": {
      "status": "blocked",
      "evidence": [
        "harness status prints no spec/plan row and every contract is valid, but exits 1: p0-unblock-the-loop breaches its 24h review SLA because its review artifact is still Status: draft. A true breach, correctly reported — the signature is human."
      ]
    },
    "B2": {
      "status": "pass",
      "evidence": [
        "test/indicators.test.mjs :: a completed chain reports an SLA verdict from the contract chain"
      ]
    },
    "B3": {
      "status": "pass",
      "evidence": [
        "test/lifecycle-cli.test.mjs :: a committed incident reaches its same-slug intent within SLA"
      ]
    },
    "B4": {
      "status": "pass",
      "evidence": [
        "test/unit.test.mjs :: incident loop requires a timestamp and the same-slug intent"
      ]
    },
    "B5": {
      "status": "pass",
      "evidence": [
        "grep finds no importer of lifecycle.mjs, no declaredFiles, and no gate reading layout.spec or layout.plan"
      ]
    },
    "B6": {
      "status": "pass",
      "evidence": [
        "test/lifecycle-cli.test.mjs :: status fails when intent acceptance has not entered git history"
      ]
    },
    "B7": {
      "status": "pass",
      "evidence": [
        "test/contract.test.mjs :: approval order is a validation boundary: acceptance before spec, spec before plan"
      ]
    }
  },
  "review": {
    "status": "pending",
    "note": "Implementation complete and checks green, except B1. Human review (gate 3) outstanding."
  }
}
