{
  "schema": "aidlc.evidence/v1",
  "change_id": "cost-is-ratcheted-too",
  "contract_digest": "sha256:6f472dc1b68812b9a56e0c596739301f17529000dc3027d9d3512d822d116e83",
  "generated_at": "2026-09-03T05:38:02.335Z",
  "capabilities": {
    "secrets": "PASS",
    "test": "PASS",
    "scope-drift": "PASS",
    "budget": "PASS"
  },
  "behaviours": {
    "B1": {
      "status": "pass",
      "evidence": [
        "test/eval-gate.test.mjs :: a task that costs more than the tolerance is a finding"
      ]
    },
    "B2": {
      "status": "pass",
      "evidence": [
        "test/eval-gate.test.mjs :: a task inside the tolerance passes on cost"
      ]
    },
    "B3": {
      "status": "pass",
      "evidence": [
        "test/eval-gate.test.mjs :: a cheaper run lowers the floor"
      ]
    },
    "B4": {
      "status": "pass",
      "evidence": [
        "test/eval-gate.test.mjs :: a dearer run must not raise the floor"
      ]
    },
    "B5": {
      "status": "pass",
      "evidence": [
        "test/eval-gate.test.mjs :: a task with no recorded floor records its observed cost"
      ]
    },
    "B6": {
      "status": "pass",
      "evidence": [
        "test/eval-gate.test.mjs :: behaviour is fine; the price is not — a costly task is not in regressed"
      ]
    },
    "B7": {
      "status": "pass",
      "evidence": [
        "test/eval-gate.test.mjs :: adding cost does not loosen the verdict ratchet"
      ]
    },
    "B8": {
      "status": "pass",
      "evidence": [
        "test/eval-gate.test.mjs :: a record written before cost was tracked still loads"
      ]
    }
  },
  "review": {
    "status": "pending",
    "note": "Implementation complete and checks green. Human review (gate 3) outstanding."
  }
}
