{
  "schema": "aidlc.evidence/v1",
  "change_id": "p0-unblock-the-loop",
  "contract_digest": "sha256:653bb08d15b705ddc04dd10085e0382c9af3560b273aa87289e9fe17fdbfae8f",
  "generated_at": "2026-09-01T05:56:07.386Z",
  "capabilities": {
    "secrets": "PASS",
    "test": "PASS — node --test test/*.test.mjs — 214 pass, 0 fail",
    "scope-drift": "PASS",
    "budget": "PASS"
  },
  "behaviours": {
    "B1": {
      "status": "pass",
      "evidence": [
        "test/guard.test.mjs :: the contract guard does not block a command that writes no product file",
        "live: `echo hi 2>/dev/null` and `harness check --stage stop 2>&1 | tail`, both refused before the change"
      ]
    },
    "B2": {
      "status": "pass",
      "evidence": [
        "test/guard.test.mjs :: the contract guard still blocks an unowned write to a product file"
      ]
    },
    "B3": {
      "status": "pass",
      "evidence": [
        "`harness check --stage commit` green; gauntlet Phase 4 still detects security-defective on all three stacks"
      ]
    },
    "B4": {
      "status": "pass",
      "evidence": [
        "test/unit.test.mjs :: a new session rotates the run id, and HARNESS_RUN_ID still pins it",
        "ledger audit went from 1 run to 66"
      ]
    }
  },
  "review": {
    "status": "pending",
    "note": "Implementation complete and checks green. Human review (gate 3) outstanding."
  }
}
