{
  "schema": "aidlc.evidence/v1",
  "change_id": "one-eval-number",
  "contract_digest": "sha256:0208cf6ae77615ba93205ccb7a4863559616c48eaf5f994ff259359dc05a1feb",
  "generated_at": "2026-09-03T05:31:14.763Z",
  "capabilities": {
    "secrets": "PASS",
    "test": "PASS",
    "scope-drift": "PASS",
    "budget": "PASS"
  },
  "behaviours": {
    "B1": {
      "status": "pass",
      "evidence": [
        "test/eval-gate.test.mjs :: the board and the gate read the results the same way"
      ]
    },
    "B2": {
      "status": "pass",
      "evidence": [
        "harness status: eval pass rate 22/22 (1), matching harness evals gate"
      ]
    },
    "B3": {
      "status": "pass",
      "evidence": [
        "test/eval-gate.test.mjs :: the widest run still sets the denominator"
      ]
    },
    "B4": {
      "status": "pass",
      "evidence": [
        "test/eval-gate.test.mjs :: with no results the board reads unmeasured"
      ]
    },
    "B5": {
      "status": "pass",
      "evidence": [
        "test/eval-gate.test.mjs :: evalGate.loadResults is indicators.loadResults — re-exported, not redefined"
      ]
    }
  },
  "review": {
    "status": "pending",
    "note": "Implementation complete and checks green. Human review (gate 3) outstanding."
  }
}
