{
  "schema": "aidlc.evidence/v1",
  "change_id": "overlay-narrow-eval-runs",
  "contract_digest": "sha256:05c848d43fb0db583c59f769825defe139d0e02fd73445d15e0e6c02d40ed671",
  "generated_at": "2026-09-02T13:49:26.762Z",
  "capabilities": {},
  "behaviours": {
    "B1": {
      "status": "pending",
      "evidence": []
    },
    "B2": {
      "status": "pending",
      "evidence": []
    },
    "B3": {
      "status": "pending",
      "evidence": []
    },
    "B4": {
      "status": "pending",
      "evidence": []
    },
    "B5": {
      "status": "pending",
      "evidence": []
    },
    "B6": {
      "status": "pending",
      "evidence": []
    }
  },
  "review": {
    "status": "pending"
  }
}
