{
  "schema": "aidlc.evidence/v1",
  "change_id": "the-ledger-cannot-judge-a-deterrent",
  "contract_digest": "sha256:70db28a851dfa19a95806aaed9e5b3a03f5f9e132cfc6091e8cd6c92eac35055",
  "generated_at": "2026-09-03T03:57:48.288Z",
  "capabilities": {
    "secrets": "PASS",
    "test": "PASS — node --test test/*.test.mjs — 214 pass, 0 fail",
    "scope-drift": "PASS",
    "budget": "PASS"
  },
  "behaviours": {
    "B1": {
      "status": "pass",
      "evidence": [
        "test/unit.test.mjs :: the audit separates a control that did not fire from one that did not run"
      ]
    },
    "B2": {
      "status": "pass",
      "evidence": [
        "same test: a control no stage or hook reaches reads unwired"
      ]
    },
    "B3": {
      "status": "pass",
      "evidence": [
        "same test: deletions holds only the unreliable control; never-fired and unwired move to decide"
      ]
    },
    "B4": {
      "status": "pass",
      "evidence": [
        "same test: a firing control still earns its place"
      ]
    },
    "B5": {
      "status": "pass",
      "evidence": [
        "same test: a staged control under the threshold is still insufficient-data"
      ]
    },
    "B6": {
      "status": "pass",
      "evidence": [
        "harness ledger audit on this repository: budget never-fired, arch and test_quality unwired, nothing in deletions"
      ]
    }
  },
  "review": {
    "status": "pending",
    "note": "Implementation complete and checks green. Human review (gate 3) outstanding."
  }
}
