{
  "schema": "aidlc.evidence/v1",
  "change_id": "recalibrate-eval-budgets",
  "contract_digest": "sha256:33a656eca1f3dc48edadb7488ff97a33d34ee46634f4d6d6c60c7226a76da6c3",
  "generated_at": "2026-09-02T13:49:26.810Z",
  "capabilities": {
    "secrets": "PASS",
    "test": "PASS — node --test test/*.test.mjs — 214 pass, 0 fail",
    "scope-drift": "PASS",
    "budget": "PASS"
  },
  "behaviours": {
    "B1": {
      "status": "pass",
      "evidence": [
        "the contract table against measured spend in .aidlc/evals/results/"
      ]
    },
    "B2": {
      "status": "pass",
      "evidence": [
        "node evals/run.mjs --dry: 22 tasks valid, 23.05 USD ceiling"
      ]
    },
    "B3": {
      "status": "pass",
      "evidence": [
        "test/evals.test.mjs :: validate rejects the four ways a task wastes money"
      ]
    },
    "B4": {
      "status": "pass",
      "evidence": [
        "the 2026-09-02 full run: contract-scope-honesty and prefix-cache-guard both still failed after the raises"
      ]
    }
  },
  "review": {
    "status": "pending",
    "note": "Implementation complete and checks green. Human review (gate 3) outstanding."
  }
}
