{
  "schema": "aidlc.evidence/v1",
  "change_id": "indicators-on-the-contract-chain",
  "contract_digest": "sha256:76e0cf70ea0281884672c5310ca07c888f3bef1b0c838d48ffb5ac221e7d310a",
  "generated_at": "2026-09-02T13:49:26.664Z",
  "capabilities": {
    "secrets": "PASS",
    "test": "PASS — node --test test/*.test.mjs — 214 pass, 0 fail",
    "scope-drift": "PASS",
    "budget": "PASS"
  },
  "behaviours": {
    "B1": {
      "status": "pass",
      "evidence": [
        "test/indicators.test.mjs :: a completed chain reports a value for every indicator"
      ]
    },
    "B2": {
      "status": "pass",
      "evidence": [
        "test/indicators.test.mjs :: an accepted intent whose acceptance was never committed does not count"
      ]
    },
    "B3": {
      "status": "pass",
      "evidence": [
        "test/indicators.test.mjs :: a spec digest that changes after the plan seal is rework"
      ]
    },
    "B4": {
      "status": "pass",
      "evidence": [
        "test/indicators.test.mjs :: a spec untouched after the plan seal counts zero rework"
      ]
    },
    "B5": {
      "status": "pass",
      "evidence": [
        "test/indicators.test.mjs :: a review that ever requested changes is not a first-pass approval"
      ]
    },
    "B6": {
      "status": "pass",
      "evidence": [
        "test/indicators.test.mjs :: a repository with no contracts reports unmeasured, not zero"
      ]
    }
  },
  "review": {
    "status": "pending",
    "note": "Implementation complete and checks green. Human review (gate 3) outstanding."
  }
}
